QN#;Heading;Requirement;Citation;Related Documents
6.17;Asbestos;The employer carries out a new monitoring of asbestos dust emissions if a modification of the installation, or conditions of productions is likely to impact the emission of asbestos dusts.;"Interministerial Order of 01 October 2003 on Protection of Workers Against Asbestos Dusts Inhalation; Art. 23";*Records for the monitoring of asbestos dust emissions
6.18;Asbestos;The employer ensures that no worker is assigned to a task involving inhalation of asbestos dust unless the worker has a valid aptitude document from the doctor.;"Interministerial Order of 01 October 2003 on Protection of Workers Against Asbestos Dusts Inhalation; Art. 17";"*Medical aptitude document
*Initial medical report"
6.19;Asbestos;Personal protective equipment is effectively used by the workers exposed to asbestos dust.;"Interministerial Order of 01 October 2003 on Protection of Workers Against Asbestos Dusts Inhalation; Art. 15";
6.20;Asbestos;Personal protective equipment against asbestos dust is checked and properly maintained.;"Interministerial Order of 01 October 2003 on Protection of Workers Against Asbestos Dusts Inhalation; Art. 15";*Checks and maintenance records of protective equipment against asbestos dust
6.21;Asbestos;The employer ensures that the medical file for each worker exposed to dusts contains information concerning accidental exposures, and results of medical examinations carried out.;"Interministerial Order of 01 October 2003 on Protection of Workers Against Asbestos Dusts Inhalation; Art. 18";*Evidence of medical file for each worker exposed to asbestos dust
6.22;Asbestos;The facility places an information notice in every workstation where activities are carried out which are likely to expose workers to asbestos dusts.;"Interministerial Order of 01 October 2003 on Protection of Workers Against Asbestos Dusts Inhalation; Art. 6";
6.23;Asbestos;The information notice posted in workstation likely to expose workers to asbestos dusts is transmitted to the doctor appointed for health and safety in the facility.;"Interministerial Order of 01 October 2003 on Protection of Workers Against Asbestos Dusts Inhalation; Art. 6";
6.24;Asbestos;The employer keeps a list of workers exposed to inhalation of asbestos dusts, the nature of their respective tasks as well as the exposure duration.;"Interministerial Order of 01 October 2003 on Protection of Workers Against Asbestos Dusts Inhalation; Art. 16";*List of workers exposed to inhalation of asbestos dusts
6.25;Asbestos;If the facility carries out activities likely to expose workers to asbestos dust, it declares such activities to the labor inspectorate and the social security service as well as to the  medical inspector of the administration of health and population in the governorate (WILAYA).;"Interministerial Order of 01 October 2003 on Protection of Workers Against Asbestos Dusts Inhalation; Art. 3";"*Notification sent to the labor inspectorate, the social security organism and the doctor-inspector of the administration of health and population in the governorate ""Wilaya""."
6.26;Asbestos;If the facility carries out activities likely to expose workers to asbestos dust, it assesses a risk evaluation to determine the nature and quantity of the fibers as well as the duration and degree of worker exposure.;"Interministerial Order of 01 October 2003 on Protection of Workers Against Asbestos Dusts Inhalation; Art. 4";*Risk evaluation assessment for activities likely to expose workers to asbestos dusts
6.27;Asbestos;It the facility cannot put in place a system of collective protection from asbestos dusts or if the collective protection is inefficient, the facility provides workers exposed to asbestos dust with adequate personal protective equipment.;"Interministerial Order of 01 October 2003 on Protection of Workers Against Asbestos Dusts Inhalation; Art. 15";
6.28;Asbestos;The employer entrusts an authorized laboratory to carry out monitoring of asbestos dust emissions at least once a year in order to comply with the permissible levels of asbestos dusts in the facility.;"Interministerial Order of 01 October 2003 on Protection of Workers Against Asbestos Dusts Inhalation; Art. 24";*Records of results of asbestos dusts monitoring
6.29;Asbestos;If the facility carries out activities likely to expose workers to asbestos dust, for newly hired workers it organizes information sessions on hazards likely to affect health, including risk-enhancing factors such as smoking.;"Interministerial Order of 01 October 2003 on Protection of Workers Against Asbestos Dusts Inhalation; Art. 7";*Employee training records
6.30;Asbestos;Premises used for asbestos transformation or treatment are regularly cleaned and maintained.;"Executive Decree No. 99-95 of 19 April 1999 on Prevention Against Asbestos Hazards; Art. 5";
6.31;Asbestos;The results of the risk evaluation to determine the nature and quantity of the fibers as well as the duration and degree of worker exposure has been transmitted to the doctor appointed for health and safety in the facility and to the members of  the bi-party commission for hygiene and safety or to the person in charge of hygiene an safety, and are made available for the labor inspectorate, and the social security services.;"Interministerial Order of 01 October 2003 on Protection of Workers Against Asbestos Dusts Inhalation; Art. 4";*Risk evaluation assessment for activities likely to expose workers to asbestos dusts
6.32;Asbestos;The list of workers exposed to inhalation of asbestos dust has been transmitted to the doctor appointed to health and safety in the facility.;"Interministerial Order of 01 October 2003 on Protection of Workers Against Asbestos Dusts Inhalation; Art. 16";*Evidence of the submission to the doctor of the list of workers exposed to asbestos dust
7.1;Ionizing Radiation;If the company has workers exposed to ionising radiation, it ensures its workers are protected against external exposure to ionizing radiation and against radioactive contamination.;"Presidential Decree 05-117 of 11 April 2005 on Protection of Workers Against Ionizing Radiation.; Art. 28 and Art. 29";
7.2;Ionizing Radiation;If the facility handles, uses or stores radioactive sources (sealed or not) or electric generators of ionizing radiation, it has designated a qualified professional competent in radiation protection, holding a valid certificate.;"Presidential Decree 05-117 of 11 April 2005 on Protection of Workers Against Ionizing Radiation.; Art. 13 and Art. 16";"*Certificate of competence in the handling of sources of ionizing radiation
*Evidence of the appointment of the qualified professional"
7.3;Ionizing Radiation;The manager has established and regularly updates a register on the characteristics and history of radioactive sources and devices emitting ionizing radiation.;"Presidential Decree 05-117 of 11 April 2005 on Protection of Workers Against Ionizing Radiation.; Art. 14";*Register on radioactive sources and devices emitting ionizing radiation
7.4;Ionizing Radiation;If the facility handles radioactive sources or devices emitting ionizing radiations, it has informed and provided trainings to its workers in radioprotection.;"Presidential Decree 05-117 of 11 April 2005 on Protection of Workers Against Ionizing Radiation.; Art. 15";*Employee training records
7.5;Ionizing Radiation;The employer ensures that the occupational exposure ionizing radiation of all workers does not exceed the limits of exposure set by law.;"Presidential Decree 05-117 of 11 April 2005 on Protection of Workers Against Ionizing Radiation.; Art. 18";*Records of ionizing radiation exposure monitoring
7.6;Ionizing Radiation;The employer classifies the workers exposed to ionizing radiation in Class A or Class B workers, according to their potential level of exposure.;"Presidential Decree 05-117 of 11 April 2005 on Protection of Workers Against Ionizing Radiation.; Art. 19";*Records of ionizing radiation exposure monitoring
7.7;Ionizing Radiation;Installations that include/rely on using sources of ionizing radiation are equipped with a radiological protection device.;"Presidential Decree 05-117 of 11 April 2005 on Protection of Workers Against Ionizing Radiation.; Art. 24";
7.8;Ionizing Radiation;The manager of the facility has identified controlled areas and supervised areas around the ionizing radiation source prior to putting into service the source.;"Presidential Decree 05-117 of 11 April 2005 on Protection of Workers Against Ionizing Radiation.; Art. 26 and Art. 27";*Map of the facility identifying controlled and supervised areas
7.9;Ionizing Radiation;Controlled and supervised areas are appropriately marked.;"Presidential Decree 05-117 of 11 April 2005 on Protection of Workers Against Ionizing Radiation.; Art. 27
Interministerial Order of 20 January 2011 Regulating Specific Signaling in Regulated Areas containing Ionizing Radiation Sources; Art. 3";
7.10;Ionizing Radiation;Radioactive sources and devices emitting ionizing radiation are checked and maintained regularly by properly qualified and designated persons.;"Executive Decree 91-05 of 19 January 1991 on General Prescriptions for Protection Relative to Hygiene and Safety in Workplaces; Art. 62";*Records of devices emitting ionizing radiation
7.11;Ionizing Radiation;The facility manager organizes an individual dosimetry for each worker working in a controlled area.;"Presidential Decree 05-117 of 11 April 2005 on Protection of Workers Against Ionizing Radiation.; Art. 30";*Records of individual dosimetry results
7.12;Ionizing Radiation;The results of the individual dosimetry carried out on workers working in controlled areas are registered in the individual medical records of workers concerned.;"Presidential Decree 05-117 of 11 April 2005 on Protection of Workers Against Ionizing Radiation.; Art. 30";*Individual medical records showing dosimetry results
7.13;Ionizing Radiation;If the facility has Class A workers exposed or likely to be exposed to ionizing radiation in excess of 3/10 of the annual dose limit, it ensures they undergo a specific medical supervision.;"Presidential Decree 05-117 of 11 April 2005 on Protection of Workers Against Ionizing Radiation.; Art. 35";*Medical file for A-class workers
7.14;Ionizing Radiation;The occupational physician has established a specific medical file for each Class A worker.;"Presidential Decree 05-117 of 11 April 2005 on Protection of Workers Against Ionizing Radiation.; Art. 41
Order the Minister of Ministry of Health, Population, and Hospital Reform of 10 November 2015 concerning the medical supervision on workers exposed to ionizing radiation; Art. 7; Annex";*Medical file for A-class workers
7.15;Ionizing Radiation;The facility ensures that radiological monitoring devices are maintained and tested, and are re-calibrated at least once a year.;"Presidential Decree 05-117 of 11 April 2005 on Protection of Workers Against Ionizing Radiation.; Art. 49";*Records of maintenance of radiological monitoring devices
7.16;Ionizing Radiation;The facility ensures that premises in which radioactive sources can be found are equipped with a key closing system and have regulatory signalization displays.;"Presidential Decree 05-117 of 11 April 2005 on Protection of Workers Against Ionizing Radiation.; Art. 45";
7.17;Ionizing Radiation;The facility ensures that radioactive substances are stored in appropriate containers, and are only accessible to the persons appointed by the manager.;"Presidential Decree 05-117 of 11 April 2005 on Protection of Workers Against Ionizing Radiation.; Art. 50 and Art. 51";*List of the persons appointed by the facility manager to access the storage areas of radioactive substances
7.18;Ionizing Radiation;If the facility uses radioactive sources, it undertakes all the required monitoring operations.;"Presidential Decree 05-117 of 11 April 2005 on Protection of Workers Against Ionizing Radiation.; Art. 57 and Art. 58 and Art. 59";
7.19;Ionizing Radiation;The supervised area has been periodically checked, delineated appropriately and provided with signs regulating access to it.;"Executive Decree 91-05 of 19 January 1991 on General Prescriptions for Protection Relative to Hygiene and Safety in Workplaces; Art. 26";
7.20;Ionizing Radiation;The facility ensures that both supervised and controlled areas are delineated;"Executive Decree 91-05 of 19 January 1991 on General Prescriptions for Protection Relative to Hygiene and Safety in Workplaces; Art. 27";
7.21;Ionizing Radiation;Employers ensure that each worker's exposure to ionizing radiation in controlled areas is measured using an individual dosimeter.;"Interministerial Order of 20 January 2011 on Individual Dosimeter Use; Art. 3";*Individual medical records showing dosimetry results
7.22;Ionizing Radiation;If the facility has workers exposed to x-rays, gamma rays, neutrons, charged particle beams and energy beta in excess of 100 kiloelectron volts (KeV), the employer ensures that external individual dosimeters are used to measure the level of exposure of such workers to ionizing radiation.;"Interministerial Order of 20 January 2011 on Individual Dosimeter Use; Art. 5";*Records of external individual dosimeters
7.23;Ionizing Radiation;If the facility assigns workers to positions that expose them to ionizing radiation, it has obtained the attestation of the work physician on their fitness to take such jobs.;"Order the Minister of Ministry of Health, Population, and Hospital Reform of 10 November 2015 concerning the medical supervision on workers exposed to ionizing radiation; Art. 3";*Evidence on the attestation of the work physician on the ability of workers to carry out duties exposing them to ionizing radiation
7.24;Ionizing Radiation;If the facility has workers exposed to ionizing radiation, it ensures that they undergo regular medical testing.;"Presidential Decree 05-117 of 11 April 2005 on Protection of Workers Against Ionizing Radiation.; Art. 18; Art. 19
Order the Minister of Ministry of Health, Population, and Hospital Reform of 10 November 2015 concerning the medical supervision on workers exposed to ionizing radiation; Art. 4; Art. 8; Art. 10, 11, and 12";*Records of medical examinations
7.25;Ionizing Radiation;If the facility has workers exposed to ionizing radiation, it keeps their medical files up-to-date with the results of the latest medical tests conducted on them.;"Order the Minister of Ministry of Health, Population, and Hospital Reform of 10 November 2015 concerning the medical supervision on workers exposed to ionizing radiation; Art. 7";*Workers individual medical files
7.26;Ionizing Radiation;If the facility employs workers in positions that expose them to ionizing radiation, it ensures that such workers are informed on the hazards associated with the exposure to ionizing radiation and the need for following the regular medical examinations and the protection measure adopted in the facility after every medical examination they undertake.;"Order the Minister of Ministry of Health, Population, and Hospital Reform of 10 November 2015 concerning the medical supervision on workers exposed to ionizing radiation; Art. 6";*Evidence indicating the communication of information on the hazards associated with the exposure to ionizing radiation to the workers exposed to such radiation
7.27;Ionizing Radiation;If the facility intends to employ workers in positions that expose them to ionizing radiation, it ensures they undergo additional medical examinations before they start their work.;"Order the Minister of Ministry of Health, Population, and Hospital Reform of 10 November 2015 concerning the medical supervision on workers exposed to ionizing radiation; Art. 13";*Workers individual medical files
7.28;Ionizing Radiation;The facility ensures that the work physician conducts medical tests on the exposed workers and provide them with the necessary treatment after the occurrence of an industrial accident that leads to an excessive exposure to ionizing radiation.;"Presidential Decree 05-117 of 11 April 2005 on Protection of Workers Against Ionizing Radiation.; Art. 18
Order the Minister of Ministry of Health, Population, and Hospital Reform of 10 November 2015 concerning the medical supervision on workers exposed to ionizing radiation; Art. 15";
7.29;Ionizing Radiation;If the facility suffered from an industrial accident leading to excessive exposure to ionizing radiation, it ensures that the work physician and the radiation protection expert conduct an investigation on the causes of such accident.;"Presidential Decree 05-117 of 11 April 2005 on Protection of Workers Against Ionizing Radiation.; Art. 18
Order the Minister of Ministry of Health, Population, and Hospital Reform of 10 November 2015 concerning the medical supervision on workers exposed to ionizing radiation; Art. 19";*Records on the investigations conducted after the occurrence of industrial accidents leading to the excessive exposure to ionizing radiation
7.30;Ionizing Radiation;If an industrial accident occurred at the facility and it lead to an excessive exposure of workers to ionizing radiation, it eliminates the reasons that cause such accident after conducting the appropriate investigations.;"Presidential Decree 05-117 of 11 April 2005 on Protection of Workers Against Ionizing Radiation.; Art. 18
Order the Minister of Ministry of Health, Population, and Hospital Reform of 10 November 2015 concerning the medical supervision on workers exposed to ionizing radiation; Art. 19";*Records on the investigations conducted after the occurrence of industrial accidents leading to the excessive exposure to ionizing radiation
7.31;Ionizing Radiation;If the company undertakes activities in regulated areas, it appoints a radio-protection officer to perform the signage of the regulated areas.;"Interministerial Order of 20 January 2011 Regulating Specific Signaling in Regulated Areas containing Ionizing Radiation Sources; Article 3";
